    1 0.000000000 10.203.96.113 → 104.18.27.90 TCP 66 34134 → 443 [ACK] Seq=1 Ack=1 Win=72 Len=0 TSval=3083419106 TSecr=777684292
    2 0.085382397 104.18.27.90 → 10.203.96.113 TCP 66 [TCP ACKed unseen segment] 443 → 34134 [ACK] Seq=1 Ack=2 Win=17 Len=0 TSval=777730494 TSecr=3083372907
    3 4.700104421 10.203.96.113 → 142.251.221.170 UDP 71 43992 → 443 Len=29
    4 4.795801977 142.251.221.170 → 10.203.96.113 UDP 185 443 → 43992 Len=143
    5 4.795802629 142.251.221.170 → 10.203.96.113 UDP 67 443 → 43992 Len=25
    6 4.803915430 10.203.96.113 → 142.251.221.170 UDP 75 43992 → 443 Len=33
    7 6.677720437 10.203.96.113 → 10.203.96.46 DNS 72 Standard query 0x1e5c A facebook.com
    8 6.697405200 10.203.96.46 → 10.203.96.113 DNS 88 Standard query response 0x1e5c A facebook.com A 157.240.23.35
    9 6.699896449 10.203.96.113 → 10.203.96.46 DNS 72 Standard query 0xf96e AAAA facebook.com
   10 6.713479050 10.203.96.46 → 10.203.96.113 DNS 100 Standard query response 0xf96e AAAA facebook.com AAAA 2a03:2880:f137:83:face:b00c:0:25de
   11 8.717195646 10.203.96.113 → 10.203.96.46 DNS 70 Standard query 0xb0cc A google.com
   12 8.717221955 10.203.96.113 → 10.203.96.46 DNS 70 Standard query 0x8e31 AAAA google.com
   13 8.891717795 10.203.96.46 → 10.203.96.113 DNS 86 Standard query response 0xb0cc A google.com A 142.251.221.174
   14 8.894981829 10.203.96.46 → 10.203.96.113 DNS 98 Standard query response 0x8e31 AAAA google.com AAAA 2404:6800:4007:830::200e
   15 8.895543960 10.203.96.113 → 142.251.221.174 ICMP 98 Echo (ping) request  id=0x0002, seq=1/256, ttl=64
   16 8.994143835 142.251.221.174 → 10.203.96.113 ICMP 98 Echo (ping) reply    id=0x0002, seq=1/256, ttl=117 (request in 15)
   17 8.994696749 10.203.96.113 → 10.203.96.46 DNS 88 Standard query 0xae8f PTR 174.221.251.142.in-addr.arpa
   18 9.096517306 10.203.96.46 → 10.203.96.113 DNS 128 Standard query response 0xae8f PTR 174.221.251.142.in-addr.arpa PTR pnmaaa-au-in-f14.1e100.net
   19 9.896058940 10.203.96.113 → 142.251.221.174 ICMP 98 Echo (ping) request  id=0x0002, seq=2/512, ttl=64
   20 10.120573340 142.251.221.174 → 10.203.96.113 ICMP 98 Echo (ping) reply    id=0x0002, seq=2/512, ttl=117 (request in 19)
   21 10.123843977 06:d3:5d:1b:cd:8c → AzureWaveTec_0e:ac:79 ARP 42 Who has 10.203.96.113? Tell 10.203.96.46
   22 10.123856911 AzureWaveTec_0e:ac:79 → 06:d3:5d:1b:cd:8c ARP 42 10.203.96.113 is at d8:c0:a6:0e:ac:79
   23 10.897511393 10.203.96.113 → 142.251.221.174 ICMP 98 Echo (ping) request  id=0x0002, seq=3/768, ttl=64
   24 10.939704710 142.251.221.174 → 10.203.96.113 ICMP 98 Echo (ping) reply    id=0x0002, seq=3/768, ttl=117 (request in 23)
   25 11.898829264 10.203.96.113 → 142.251.221.174 ICMP 98 Echo (ping) request  id=0x0002, seq=4/1024, ttl=64
   26 11.963706353 142.251.221.174 → 10.203.96.113 ICMP 98 Echo (ping) reply    id=0x0002, seq=4/1024, ttl=117 (request in 25)
   27 12.899814873 10.203.96.113 → 142.251.221.174 ICMP 98 Echo (ping) request  id=0x0002, seq=5/1280, ttl=64
   28 12.987730637 142.251.221.174 → 10.203.96.113 ICMP 98 Echo (ping) reply    id=0x0002, seq=5/1280, ttl=117 (request in 27)
   29 13.900049728 10.203.96.113 → 142.251.221.174 ICMP 98 Echo (ping) request  id=0x0002, seq=6/1536, ttl=64
   30 14.011723842 142.251.221.174 → 10.203.96.113 ICMP 98 Echo (ping) reply    id=0x0002, seq=6/1536, ttl=117 (request in 29)
   31 14.368011584 10.203.96.113 → 18.97.36.23  TCP 66 37430 → 443 [ACK] Seq=1 Ack=1 Win=75 Len=0 TSval=2591508601 TSecr=1510222188
   32 14.816932082  18.97.36.23 → 10.203.96.113 TCP 66 [TCP ACKed unseen segment] 443 → 37430 [ACK] Seq=1 Ack=2 Win=375 Len=0 TSval=1510267560 TSecr=2591463641
   33 14.901826255 10.203.96.113 → 142.251.221.174 ICMP 98 Echo (ping) request  id=0x0002, seq=7/1792, ttl=64
   34 14.992616945 10.203.96.113 → 18.97.36.23  TLSv1.2 307 [TCP Previous segment not captured] , Application Data
   35 14.996010531 142.251.221.174 → 10.203.96.113 ICMP 98 Echo (ping) reply    id=0x0002, seq=7/1792, ttl=117 (request in 33)
   36 15.448579972  18.97.36.23 → 10.203.96.113 TLSv1.2 184 Application Data
   37 15.448649292 10.203.96.113 → 18.97.36.23  TCP 66 37430 → 443 [ACK] Seq=243 Ack=119 Win=75 Len=0 TSval=2591509681 TSecr=1510268188
   38 15.903104640 10.203.96.113 → 142.251.221.174 ICMP 98 Echo (ping) request  id=0x0002, seq=8/2048, ttl=64
   39 16.059639560 142.251.221.174 → 10.203.96.113 ICMP 98 Echo (ping) reply    id=0x0002, seq=8/2048, ttl=117 (request in 38)
   40 16.904061904 10.203.96.113 → 142.251.221.174 ICMP 98 Echo (ping) request  id=0x0002, seq=9/2304, ttl=64
   41 16.981218456 142.251.221.174 → 10.203.96.113 ICMP 98 Echo (ping) reply    id=0x0002, seq=9/2304, ttl=117 (request in 40)
   42 17.015227778 10.203.96.113 → 10.203.96.46 DNS 75 Standard query 0x5df6 A unagi.amazon.in
   43 17.015279044 10.203.96.113 → 10.203.96.46 DNS 75 Standard query 0x4f58 HTTPS unagi.amazon.in
   44 17.027883396 10.203.96.113 → 10.203.96.46 DNS 76 Standard query 0xcd8f A fls-eu.amazon.in
   45 17.027935743 10.203.96.113 → 10.203.96.46 DNS 76 Standard query 0xfe68 HTTPS fls-eu.amazon.in
   46 17.028153881 10.203.96.113 → 54.194.108.104 TLSv1.2 146 Application Data
   47 17.028191361 10.203.96.113 → 54.194.108.104 TLSv1.2 999 Application Data, Application Data
   48 17.036345651 10.203.96.46 → 10.203.96.113 DNS 124 Standard query response 0x5df6 A unagi.amazon.in CNAME unagi-eu.amazon.com A 3.254.238.163
   49 17.039551306 10.203.96.46 → 10.203.96.113 DNS 183 Standard query response 0x4f58 HTTPS unagi.amazon.in CNAME unagi-eu.amazon.com SOA ns-1504.awsdns-60.org
   50 17.040172768 10.203.96.113 → 3.254.238.163 TCP 74 58274 → 443 [SYN] Seq=0 Win=64240 Len=0 MSS=1460 SACK_PERM TSval=2218994362 TSecr=0 WS=1024
   51 17.086929298 10.203.96.46 → 10.203.96.113 DNS 311 Standard query response 0xcd8f A fls-eu.amazon.in CNAME fls-eu.amazon.com CNAME gateway.prod.eu-west-1.forester.a2z.com CNAME endpoint.prod.eu-west-1.forester.a2z.com A 54.72.119.64 A 63.34.147.145 A 52.17.51.39 A 34.253.148.73 A 108.128.154.220 A 54.194.35.92 A 54.220.91.53 A 52.212.83.143
   52 17.086929659 10.203.96.46 → 10.203.96.113 DNS 257 Standard query response 0xfe68 HTTPS fls-eu.amazon.in CNAME fls-eu.amazon.com CNAME gateway.prod.eu-west-1.forester.a2z.com CNAME endpoint.prod.eu-west-1.forester.a2z.com SOA ns-644.awsdns-16.net
   53 17.288428978 54.194.108.104 → 10.203.96.113 TCP 66 443 → 57204 [ACK] Seq=1 Ack=1014 Win=425 Len=0 TSval=3796763511 TSecr=3447997870
   54 17.288429319 54.194.108.104 → 10.203.96.113 TLSv1.2 112 Application Data
   55 17.288429409 54.194.108.104 → 10.203.96.113 TLSv1.2 272 Application Data
   56 17.288429499 3.254.238.163 → 10.203.96.113 TCP 74 443 → 58274 [SYN, ACK] Seq=0 Ack=1 Win=62643 Len=0 MSS=1440 SACK_PERM TSval=2330147921 TSecr=2218994362 WS=128
   57 17.288496985 10.203.96.113 → 3.254.238.163 TCP 66 58274 → 443 [ACK] Seq=1 Ack=1 Win=64512 Len=0 TSval=2218994610 TSecr=2330147921
   58 17.288582435 10.203.96.113 → 54.194.108.104 TCP 66 57204 → 443 [ACK] Seq=1014 Ack=253 Win=86 Len=0 TSval=3447998130 TSecr=3796763511
   59 17.293236879 10.203.96.113 → 3.254.238.163 SSL 1494 
   60 17.293259862 10.203.96.113 → 3.254.238.163 TLSv1.2 459 Client Hello (SNI=unagi.amazon.in)
   61 17.493239148 3.254.238.163 → 10.203.96.113 TCP 66 443 → 58274 [ACK] Seq=1 Ack=1429 Win=61184 Len=0 TSval=2330148174 TSecr=2218994615
   62 17.493239499 3.254.238.163 → 10.203.96.113 TCP 66 443 → 58274 [ACK] Seq=1 Ack=1822 Win=60800 Len=0 TSval=2330148175 TSecr=2218994615
   63 17.493239589 3.254.238.163 → 10.203.96.113 TLSv1.3 2922 Server Hello, Change Cipher Spec, Application Data
   64 17.493239679 3.254.238.163 → 10.203.96.113 TCP 1306 443 → 58274 [PSH, ACK] Seq=2857 Ack=1822 Win=60800 Len=1240 TSval=2330148178 TSecr=2218994615
   65 17.493239769 3.254.238.163 → 10.203.96.113 TLSv1.3 2393 Application Data, Application Data, Application Data
   66 17.493300082 10.203.96.113 → 3.254.238.163 TCP 66 58274 → 443 [ACK] Seq=1822 Ack=2857 Win=62464 Len=0 TSval=2218994815 TSecr=2330148178
   67 17.493315561 10.203.96.113 → 3.254.238.163 TCP 66 58274 → 443 [ACK] Seq=1822 Ack=4097 Win=61440 Len=0 TSval=2218994815 TSecr=2330148178
   68 17.493337542 10.203.96.113 → 3.254.238.163 TCP 66 58274 → 443 [ACK] Seq=1822 Ack=6424 Win=59392 Len=0 TSval=2218994815 TSecr=2330148181
   69 17.498310783 10.203.96.113 → 3.254.238.163 TLSv1.3 130 Change Cipher Spec, Application Data
   70 17.498673692 10.203.96.113 → 3.254.238.163 TLSv1.3 1194 Application Data
   71 17.498737090 10.203.96.113 → 3.254.238.163 TLSv1.3 1494 
   72 17.498743592 10.203.96.113 → 3.254.238.163 TCP 1494 58274 → 443 [PSH, ACK] Seq=4442 Ack=6424 Win=59392 Len=1428 TSval=2218994820 TSecr=2330148181
   73 17.499781844 10.203.96.113 → 3.254.238.163 TCP 1494 58274 → 443 [ACK] Seq=5870 Ack=6424 Win=59392 Len=1428 TSval=2218994821 TSecr=2330148181
   74 17.499787575 10.203.96.113 → 3.254.238.163 TCP 1494 58274 → 443 [PSH, ACK] Seq=7298 Ack=6424 Win=59392 Len=1428 TSval=2218994821 TSecr=2330148181
   75 17.503108996 10.203.96.113 → 3.254.238.163 TCP 1494 58274 → 443 [ACK] Seq=8726 Ack=6424 Win=59392 Len=1428 TSval=2218994825 TSecr=2330148181
   76 17.503129755 10.203.96.113 → 3.254.238.163 TLSv1.3 528 Application Data
   77 17.701287174 3.254.238.163 → 10.203.96.113 TCP 66 443 → 58274 [ACK] Seq=6424 Ack=8726 Win=56576 Len=0 TSval=2330148383 TSecr=2218994820
   78 17.701287534 3.254.238.163 → 10.203.96.113 TLSv1.3 145 Application Data
   79 17.701287625 3.254.238.163 → 10.203.96.113 TLSv1.3 145 Application Data
   80 17.701287715 3.254.238.163 → 10.203.96.113 TCP 66 443 → 58274 [ACK] Seq=6582 Ack=10616 Win=56576 Len=0 TSval=2330148385 TSecr=2218994825
   81 17.701287805 3.254.238.163 → 10.203.96.113 TLSv1.3 681 Application Data
   82 17.701432095 10.203.96.113 → 3.254.238.163 TCP 66 58274 → 443 [ACK] Seq=10616 Ack=7197 Win=59392 Len=0 TSval=2218995023 TSecr=2330148383
   83 17.905289183 10.203.96.113 → 142.251.221.174 ICMP 98 Echo (ping) request  id=0x0002, seq=10/2560, ttl=64
   84 18.107711467 142.251.221.174 → 10.203.96.113 ICMP 98 Echo (ping) reply    id=0x0002, seq=10/2560, ttl=117 (request in 83)
   85 18.464811178 10.203.96.113 → 3.254.238.163 TLSv1.3 1192 Application Data
   86 18.464957131 10.203.96.113 → 3.254.238.163 TLSv1.3 1494 
   87 18.464963403 10.203.96.113 → 3.254.238.163 TCP 1494 58274 → 443 [PSH, ACK] Seq=13170 Ack=7197 Win=59392 Len=1428 TSval=2218995786 TSecr=2330148383
   88 18.468231204 10.203.96.113 → 3.254.238.163 TCP 1494 58274 → 443 [ACK] Seq=14598 Ack=7197 Win=59392 Len=1428 TSval=2218995790 TSecr=2330148383
   89 18.468241633 10.203.96.113 → 3.254.238.163 TCP 1494 58274 → 443 [PSH, ACK] Seq=16026 Ack=7197 Win=59392 Len=1428 TSval=2218995790 TSecr=2330148383
   90 18.471520164 10.203.96.113 → 3.254.238.163 TCP 1494 58274 → 443 [ACK] Seq=17454 Ack=7197 Win=59392 Len=1428 TSval=2218995793 TSecr=2330148383
   91 18.471536154 10.203.96.113 → 3.254.238.163 TCP 1494 58274 → 443 [PSH, ACK] Seq=18882 Ack=7197 Win=59392 Len=1428 TSval=2218995793 TSecr=2330148383
   92 18.474767467 10.203.96.113 → 3.254.238.163 TCP 1494 58274 → 443 [ACK] Seq=20310 Ack=7197 Win=59392 Len=1428 TSval=2218995796 TSecr=2330148383
   93 18.474780852 10.203.96.113 → 3.254.238.163 TCP 1494 58274 → 443 [PSH, ACK] Seq=21738 Ack=7197 Win=59392 Len=1428 TSval=2218995796 TSecr=2330148383
   94 18.478004391 10.203.96.113 → 3.254.238.163 TCP 1494 58274 → 443 [ACK] Seq=23166 Ack=7197 Win=59392 Len=1428 TSval=2218995800 TSecr=2330148383
   95 18.482024709 10.203.96.113 → 54.194.108.104 TLSv1.2 146 Application Data
   96 18.482104378 10.203.96.113 → 54.194.108.104 TLSv1.2 953 Application Data
   97 18.484690094 10.203.96.113 → 10.203.96.46 DNS 73 Standard query 0x1b17 A www.amazon.in
   98 18.484783929 10.203.96.113 → 10.203.96.46 DNS 73 Standard query 0x0431 HTTPS www.amazon.in
   99 18.517296462 10.203.96.46 → 10.203.96.113 DNS 213 Standard query response 0x1b17 A www.amazon.in CNAME tp.c95e7e602-frontier.amazon.in CNAME www.amazon.in.edgekey.net CNAME e15322.dsca.akamaiedge.net A 104.121.230.99
  100 18.517296862 10.203.96.46 → 10.203.96.113 DNS 275 Standard query response 0x0431 HTTPS www.amazon.in CNAME tp.c95e7e602-frontier.amazon.in CNAME www.amazon.in.edgekey.net CNAME e15322.dsca.akamaiedge.net SOA n0dsca.akamaiedge.net
  101 18.518056022 10.203.96.113 → 104.121.230.99 QUIC 1292 Initial, DCID=241a8785cf78c850, PKN: 1, CRYPTO, CRYPTO, PING, CRYPTO, CRYPTO, CRYPTO, PADDING, CRYPTO, PADDING, CRYPTO, CRYPTO, PADDING, PING, CRYPTO, CRYPTO, PADDING, CRYPTO, PADDING
  102 18.518084255 10.203.96.113 → 104.121.230.99 QUIC 1292 Initial, DCID=241a8785cf78c850, PKN: 2, PING, PING, PING, CRYPTO, CRYPTO, PING, PADDING, CRYPTO, PING, PING, CRYPTO, PING, CRYPTO, CRYPTO, CRYPTO, PADDING, CRYPTO, CRYPTO, PING
  103 18.722027854 104.121.230.99 → 10.203.96.113 QUIC 1292 Initial, SCID=027ad48e41412f1a, PKN: 1, ACK, PADDING
  104 18.722028205 104.121.230.99 → 10.203.96.113 QUIC 1292 Initial, SCID=027ad48e41412f1a, PKN: 2, CRYPTO, PADDING
  105 18.722028285 104.121.230.99 → 10.203.96.113 QUIC 279 Handshake, SCID=027ad48e41412f1a
  106 18.722095852 3.254.238.163 → 10.203.96.113 TCP 66 443 → 58274 [ACK] Seq=7197 Ack=13170 Win=56576 Len=0 TSval=2330149348 TSecr=2218995786
  107 18.722096092 3.254.238.163 → 10.203.96.113 TCP 66 443 → 58274 [ACK] Seq=7197 Ack=16026 Win=56576 Len=0 TSval=2330149351 TSecr=2218995786
  108 18.722096182 3.254.238.163 → 10.203.96.113 TCP 66 443 → 58274 [ACK] Seq=7197 Ack=18882 Win=56576 Len=0 TSval=2330149354 TSecr=2218995790
  109 18.722096272 3.254.238.163 → 10.203.96.113 TCP 66 443 → 58274 [ACK] Seq=7197 Ack=21738 Win=56576 Len=0 TSval=2330149359 TSecr=2218995793
  110 18.722096363 3.254.238.163 → 10.203.96.113 TCP 66 443 → 58274 [ACK] Seq=7197 Ack=24594 Win=56576 Len=0 TSval=2330149360 TSecr=2218995796
  111 18.722167856 10.203.96.113 → 3.254.238.163 TCP 1494 58274 → 443 [ACK] Seq=24594 Ack=7197 Win=59392 Len=1428 TSval=2218996044 TSecr=2330149348
  112 18.722190549 10.203.96.113 → 3.254.238.163 TCP 1494 58274 → 443 [PSH, ACK] Seq=26022 Ack=7197 Win=59392 Len=1428 TSval=2218996044 TSecr=2330149348
  113 18.722230634 10.203.96.113 → 3.254.238.163 TLSv1.3 1494 Application Data
  114 18.722235553 10.203.96.113 → 3.254.238.163 TCP 1494 58274 → 443 [PSH, ACK] Seq=28878 Ack=7197 Win=59392 Len=1428 TSval=2218996044 TSecr=2330149360
  115 18.722261842 54.194.108.104 → 10.203.96.113 TCP 66 443 → 57204 [ACK] Seq=253 Ack=1981 Win=425 Len=0 TSval=3796764966 TSecr=3447999324
  116 18.722262062 54.194.108.104 → 10.203.96.113 TLSv1.2 273 Application Data
  117 18.725368872 10.203.96.113 → 3.254.238.163 TCP 1494 58274 → 443 [ACK] Seq=30306 Ack=7197 Win=59392 Len=1428 TSval=2218996047 TSecr=2330149360
  118 18.725387337 10.203.96.113 → 3.254.238.163 TCP 1494 58274 → 443 [PSH, ACK] Seq=31734 Ack=7197 Win=59392 Len=1428 TSval=2218996047 TSecr=2330149360
  119 18.726393228 10.203.96.113 → 104.121.230.99 QUIC 1292 Handshake, DCID=027ad48e41412f1a
  120 18.727184708 10.203.96.113 → 104.121.230.99 QUIC 115 Handshake, DCID=027ad48e41412f1a
  121 18.727345399 10.203.96.113 → 104.121.230.99 QUIC 110 Protected Payload (KP0), DCID=027ad48e41412f1a
  122 18.727795631 10.203.96.113 → 104.121.230.99 QUIC 1292 Protected Payload (KP0), DCID=027ad48e41412f1a
  123 18.727822952 10.203.96.113 → 104.121.230.99 QUIC 320 Protected Payload (KP0), DCID=027ad48e41412f1a
  124 18.728169720 10.203.96.113 → 104.121.230.99 QUIC 1292 Protected Payload (KP0), DCID=027ad48e41412f1a
  125 18.728204405 10.203.96.113 → 104.121.230.99 QUIC 146 Protected Payload (KP0), DCID=027ad48e41412f1a
  126 18.728581140 10.203.96.113 → 3.254.238.163 TCP 1494 58274 → 443 [ACK] Seq=33162 Ack=7197 Win=59392 Len=1428 TSval=2218996050 TSecr=2330149360
  127 18.728586931 10.203.96.113 → 3.254.238.163 TCP 1494 58274 → 443 [PSH, ACK] Seq=34590 Ack=7197 Win=59392 Len=1428 TSval=2218996050 TSecr=2330149360
  128 18.731808666 10.203.96.113 → 3.254.238.163 TCP 1494 58274 → 443 [ACK] Seq=36018 Ack=7197 Win=59392 Len=1428 TSval=2218996053 TSecr=2330149360
  129 18.731811612 10.203.96.113 → 3.254.238.163 TCP 1494 58274 → 443 [PSH, ACK] Seq=37446 Ack=7197 Win=59392 Len=1428 TSval=2218996053 TSecr=2330149360
  130 18.735071358 10.203.96.113 → 3.254.238.163 TCP 1494 58274 → 443 [ACK] Seq=38874 Ack=7197 Win=59392 Len=1428 TSval=2218996057 TSecr=2330149360
  131 18.735075345 10.203.96.113 → 3.254.238.163 TCP 1494 58274 → 443 [PSH, ACK] Seq=40302 Ack=7197 Win=59392 Len=1428 TSval=2218996057 TSecr=2330149360
  132 18.738434166 10.203.96.113 → 3.254.238.163 TCP 1494 58274 → 443 [ACK] Seq=41730 Ack=7197 Win=59392 Len=1428 TSval=2218996060 TSecr=2330149360
  133 18.738457861 10.203.96.113 → 3.254.238.163 TLSv1.3 1494 Application Data
  134 18.741646955 10.203.96.113 → 3.254.238.163 TCP 1494 58274 → 443 [ACK] Seq=44586 Ack=7197 Win=59392 Len=1428 TSval=2218996063 TSecr=2330149360
  135 18.741659488 10.203.96.113 → 3.254.238.163 TCP 1494 58274 → 443 [PSH, ACK] Seq=46014 Ack=7197 Win=59392 Len=1428 TSval=2218996063 TSecr=2330149360
  136 18.744891753 10.203.96.113 → 3.254.238.163 TCP 1494 58274 → 443 [ACK] Seq=47442 Ack=7197 Win=59392 Len=1428 TSval=2218996066 TSecr=2330149360
  137 18.744900319 10.203.96.113 → 3.254.238.163 TCP 1494 58274 → 443 [PSH, ACK] Seq=48870 Ack=7197 Win=59392 Len=1428 TSval=2218996066 TSecr=2330149360
  138 18.748126733 10.203.96.113 → 3.254.238.163 TCP 1494 58274 → 443 [ACK] Seq=50298 Ack=7197 Win=59392 Len=1428 TSval=2218996070 TSecr=2330149360
  139 18.748130399 10.203.96.113 → 3.254.238.163 TCP 1494 58274 → 443 [PSH, ACK] Seq=51726 Ack=7197 Win=59392 Len=1428 TSval=2218996070 TSecr=2330149360
  140 18.760517725 104.121.230.99 → 10.203.96.113 QUIC 329 Protected Payload (KP0)
  141 18.760518076 104.121.230.99 → 10.203.96.113 QUIC 100 Protected Payload (KP0)
  142 18.760797429 10.203.96.113 → 104.121.230.99 QUIC 73 Protected Payload (KP0), DCID=027ad48e41412f1a
  143 18.763744269 104.121.230.99 → 10.203.96.113 QUIC 63 Protected Payload (KP0)
  144 18.763744420 104.121.230.99 → 10.203.96.113 QUIC 112 Protected Payload (KP0)
  145 18.763744510 104.121.230.99 → 10.203.96.113 QUIC 65 Protected Payload (KP0)
  146 18.763744600 104.121.230.99 → 10.203.96.113 QUIC 65 Protected Payload (KP0)
  147 18.763850899 10.203.96.113 → 104.121.230.99 QUIC 73 Protected Payload (KP0), DCID=027ad48e41412f1a
  148 18.763973428 10.203.96.113 → 54.194.108.104 TCP 66 57204 → 443 [ACK] Seq=1981 Ack=460 Win=86 Len=0 TSval=3447999606 TSecr=3796764967
  149 18.838116655 10.203.96.113 → 3.254.238.163 TCP 74 58280 → 443 [SYN] Seq=0 Win=64240 Len=0 MSS=1460 SACK_PERM TSval=2218996160 TSecr=0 WS=1024
  150 18.841464065 104.121.230.99 → 10.203.96.113 QUIC 66 Protected Payload (KP0)
  151 18.866198962 10.203.96.113 → 10.203.96.46 DNS 76 Standard query 0x0b6d A www.facebook.com
  152 18.866300121 10.203.96.113 → 10.203.96.46 DNS 76 Standard query 0x33fc HTTPS www.facebook.com
  153 18.886006435 10.203.96.46 → 10.203.96.113 DNS 133 Standard query response 0x0b6d A www.facebook.com CNAME star-mini.c10r.facebook.com A 157.240.23.35
  154 18.889205507 10.203.96.46 → 10.203.96.113 DNS 204 Standard query response 0x33fc HTTPS www.facebook.com CNAME star-mini.c10r.facebook.com HTTPS HTTPS
  155 18.890165473 10.203.96.113 → 157.240.23.35 QUIC 1292 Initial, DCID=774bc5325f4968f1, PKN: 1, CRYPTO, CRYPTO, PING, CRYPTO, PING, PADDING, PING, PADDING, PING, PING, PADDING, PING, PADDING, CRYPTO
  156 18.890212320 10.203.96.113 → 157.240.23.35 QUIC 1292 Initial, DCID=774bc5325f4968f1, PKN: 2, PADDING, CRYPTO, PADDING, CRYPTO, PING, PING, CRYPTO, CRYPTO, CRYPTO, PING, CRYPTO, CRYPTO, PADDING, CRYPTO, PING, CRYPTO, PADDING
  157 18.890359596 10.203.96.113 → 157.240.23.35 QUIC 121 0-RTT, DCID=774bc5325f4968f1
  158 18.896324300 3.254.238.163 → 10.203.96.113 TCP 66 443 → 58274 [ACK] Seq=7197 Ack=27450 Win=56576 Len=0 TSval=2330149606 TSecr=2218996044
  159 18.896410351 10.203.96.113 → 3.254.238.163 TCP 1494 58274 → 443 [ACK] Seq=53154 Ack=7197 Win=59392 Len=1428 TSval=2218996218 TSecr=2330149606
  160 18.896423947 10.203.96.113 → 3.254.238.163 TCP 1494 58274 → 443 [PSH, ACK] Seq=54582 Ack=7197 Win=59392 Len=1428 TSval=2218996218 TSecr=2330149606
  161 18.899588254 3.254.238.163 → 10.203.96.113 TCP 66 443 → 58274 [ACK] Seq=7197 Ack=30306 Win=56576 Len=0 TSval=2330149607 TSecr=2218996044
  162 18.899684013 10.203.96.113 → 3.254.238.163 TCP 1494 58274 → 443 [ACK] Seq=56010 Ack=7197 Win=59392 Len=1428 TSval=2218996221 TSecr=2330149607
  163 18.899692990 10.203.96.113 → 3.254.238.163 TCP 1494 58274 → 443 [PSH, ACK] Seq=57438 Ack=7197 Win=59392 Len=1428 TSval=2218996221 TSecr=2330149607
  164 18.902843482 3.254.238.163 → 10.203.96.113 TCP 66 443 → 58274 [ACK] Seq=7197 Ack=33162 Win=56576 Len=0 TSval=2330149612 TSecr=2218996047
  165 18.902935995 10.203.96.113 → 3.254.238.163 TCP 1494 58274 → 443 [ACK] Seq=58866 Ack=7197 Win=59392 Len=1428 TSval=2218996224 TSecr=2330149612
  166 18.902948058 10.203.96.113 → 3.254.238.163 TLSv1.3 1494 Application Data
  167 18.906185131 3.254.238.163 → 10.203.96.113 TCP 66 443 → 58274 [ACK] Seq=7197 Ack=36018 Win=56576 Len=0 TSval=2330149614 TSecr=2218996050
  168 18.906185532 3.254.238.163 → 10.203.96.113 TCP 66 443 → 58274 [ACK] Seq=7197 Ack=38874 Win=56576 Len=0 TSval=2330149614 TSecr=2218996053
  169 18.906299004 10.203.96.113 → 3.254.238.163 TCP 1494 58274 → 443 [ACK] Seq=61722 Ack=7197 Win=59392 Len=1428 TSval=2218996228 TSecr=2330149614
  170 18.906311227 10.203.96.113 → 3.254.238.163 TCP 1494 58274 → 443 [PSH, ACK] Seq=63150 Ack=7197 Win=59392 Len=1428 TSval=2218996228 TSecr=2330149614
  171 18.909395365 10.203.96.113 → 3.254.238.163 TCP 1494 58274 → 443 [ACK] Seq=64578 Ack=7197 Win=59392 Len=1428 TSval=2218996231 TSecr=2330149614
  172 18.909412958 10.203.96.113 → 3.254.238.163 TCP 1494 58274 → 443 [PSH, ACK] Seq=66006 Ack=7197 Win=59392 Len=1428 TSval=2218996231 TSecr=2330149614
  173 18.912633531 3.254.238.163 → 10.203.96.113 TCP 66 443 → 58274 [ACK] Seq=7197 Ack=41730 Win=56576 Len=0 TSval=2330149618 TSecr=2218996057
  174 18.912633981 3.254.238.163 → 10.203.96.113 TCP 66 443 → 58274 [ACK] Seq=7197 Ack=44586 Win=56576 Len=0 TSval=2330149621 TSecr=2218996060
  175 18.912709483 10.203.96.113 → 3.254.238.163 TCP 1494 58274 → 443 [ACK] Seq=67434 Ack=7197 Win=59392 Len=1428 TSval=2218996234 TSecr=2330149621
  176 18.912722958 10.203.96.113 → 3.254.238.163 TCP 1494 58274 → 443 [PSH, ACK] Seq=68862 Ack=7197 Win=59392 Len=1428 TSval=2218996234 TSecr=2330149621
  177 18.915906481 10.203.96.113 → 3.254.238.163 TCP 1494 58274 → 443 [ACK] Seq=70290 Ack=7197 Win=59392 Len=1428 TSval=2218996237 TSecr=2330149621
  178 18.915916741 10.203.96.113 → 3.254.238.163 TCP 1494 58274 → 443 [PSH, ACK] Seq=71718 Ack=7197 Win=59392 Len=1428 TSval=2218996237 TSecr=2330149621
  179 18.919174242 157.240.23.35 → 10.203.96.113 QUIC 1274 Initial, SCID=ba00376723ec623b, PKN: 14200228, CRYPTO, ACK
  180 18.919174543 157.240.23.35 → 10.203.96.113 QUIC 964 Handshake, SCID=ba00376723ec623b
  181 18.919174613 157.240.23.35 → 10.203.96.113 QUIC 90 Protected Payload (KP0)
  182 18.919174683 157.240.23.35 → 10.203.96.113 QUIC 122 Protected Payload (KP0)
  183 18.919174743 3.254.238.163 → 10.203.96.113 TCP 66 443 → 58274 [ACK] Seq=7197 Ack=47442 Win=56576 Len=0 TSval=2330149624 TSecr=2218996063
  184 18.919174813 3.254.238.163 → 10.203.96.113 TCP 66 443 → 58274 [ACK] Seq=7197 Ack=50298 Win=56576 Len=0 TSval=2330149627 TSecr=2218996066
  185 18.919260924 10.203.96.113 → 3.254.238.163 TCP 1494 58274 → 443 [ACK] Seq=73146 Ack=7197 Win=59392 Len=1428 TSval=2218996241 TSecr=2330149627
  186 18.919271665 10.203.96.113 → 3.254.238.163 TCP 1494 58274 → 443 [ACK] Seq=74574 Ack=7197 Win=59392 Len=1428 TSval=2218996241 TSecr=2330149627
  187 18.919273758 10.203.96.113 → 3.254.238.163 TLSv1.3 1494 Application Data
  188 18.919622601 10.203.96.113 → 157.240.23.35 QUIC 123 Handshake, DCID=ba00376723ec623b
  189 18.919841140 10.203.96.113 → 157.240.23.35 QUIC 1288 Protected Payload (KP0), DCID=ba00376723ec623b
  190 18.919854905 10.203.96.113 → 157.240.23.35 QUIC 1292 Protected Payload (KP0), DCID=ba00376723ec623b
  191 18.919862309 10.203.96.113 → 157.240.23.35 QUIC 187 Protected Payload (KP0), DCID=ba00376723ec623b
  192 18.922433257 3.254.238.163 → 10.203.96.113 TCP 66 443 → 58274 [ACK] Seq=7197 Ack=53154 Win=56576 Len=0 TSval=2330149630 TSecr=2218996070
  193 18.922498028 10.203.96.113 → 3.254.238.163 TCP 1494 58274 → 443 [ACK] Seq=77430 Ack=7197 Win=59392 Len=1428 TSval=2218996244 TSecr=2330149630
  194 18.922505212 10.203.96.113 → 3.254.238.163 TCP 1494 58274 → 443 [ACK] Seq=78858 Ack=7197 Win=59392 Len=1428 TSval=2218996244 TSecr=2330149630
  195 18.922506745 10.203.96.113 → 3.254.238.163 TCP 1494 58274 → 443 [PSH, ACK] Seq=80286 Ack=7197 Win=59392 Len=1428 TSval=2218996244 TSecr=2330149630
  196 18.925719533 10.203.96.113 → 3.254.238.163 TCP 1494 58274 → 443 [ACK] Seq=81714 Ack=7197 Win=59392 Len=1428 TSval=2218996247 TSecr=2330149630
  197 18.925728770 10.203.96.113 → 3.254.238.163 TCP 1494 58274 → 443 [ACK] Seq=83142 Ack=7197 Win=59392 Len=1428 TSval=2218996247 TSecr=2330149630
  198 18.925730073 10.203.96.113 → 3.254.238.163 TCP 1494 58274 → 443 [PSH, ACK] Seq=84570 Ack=7197 Win=59392 Len=1428 TSval=2218996247 TSecr=2330149630
  199 18.928955555 10.203.96.113 → 3.254.238.163 TCP 1494 58274 → 443 [ACK] Seq=85998 Ack=7197 Win=59392 Len=1428 TSval=2218996250 TSecr=2330149630
  200 18.928965083 10.203.96.113 → 3.254.238.163 TCP 1494 58274 → 443 [ACK] Seq=87426 Ack=7197 Win=59392 Len=1428 TSval=2218996250 TSecr=2330149630
  201 18.928966515 10.203.96.113 → 3.254.238.163 TCP 1494 58274 → 443 [PSH, ACK] Seq=88854 Ack=7197 Win=59392 Len=1428 TSval=2218996250 TSecr=2330149630
  202 18.932231722 10.203.96.113 → 3.254.238.163 TCP 1494 58274 → 443 [ACK] Seq=90282 Ack=7197 Win=59392 Len=1428 TSval=2218996254 TSecr=2330149630
  203 18.932244566 10.203.96.113 → 3.254.238.163 TCP 1494 58274 → 443 [ACK] Seq=91710 Ack=7197 Win=59392 Len=1428 TSval=2218996254 TSecr=2330149630
  204 18.932245868 10.203.96.113 → 3.254.238.163 TLSv1.3 1494 Application Data
  205 18.935464367 10.203.96.113 → 3.254.238.163 TCP 1494 58274 → 443 [ACK] Seq=94566 Ack=7197 Win=59392 Len=1428 TSval=2218996257 TSecr=2330149630
  206 18.935470919 10.203.96.113 → 3.254.238.163 TCP 1494 58274 → 443 [ACK] Seq=95994 Ack=7197 Win=59392 Len=1428 TSval=2218996257 TSecr=2330149630
  207 18.935472522 10.203.96.113 → 3.254.238.163 TCP 1494 58274 → 443 [PSH, ACK] Seq=97422 Ack=7197 Win=59392 Len=1428 TSval=2218996257 TSecr=2330149630
  208 18.938801718 10.203.96.113 → 3.254.238.163 TCP 1494 58274 → 443 [ACK] Seq=98850 Ack=7197 Win=59392 Len=1428 TSval=2218996260 TSecr=2330149630
  209 18.938815915 10.203.96.113 → 3.254.238.163 TCP 1494 58274 → 443 [ACK] Seq=100278 Ack=7197 Win=59392 Len=1428 TSval=2218996260 TSecr=2330149630
  210 18.938818389 10.203.96.113 → 3.254.238.163 TCP 1494 58274 → 443 [PSH, ACK] Seq=101706 Ack=7197 Win=59392 Len=1428 TSval=2218996260 TSecr=2330149630
  211 18.942019796 10.203.96.113 → 3.254.238.163 TLSv1.3 675 Application Data
  212 18.948513400 157.240.23.35 → 10.203.96.113 QUIC 82 Handshake, SCID=ba00376723ec623b
  213 18.948513721 157.240.23.35 → 10.203.96.113 QUIC 154 Protected Payload (KP0)
  214 18.948513811 157.240.23.35 → 10.203.96.113 QUIC 90 Protected Payload (KP0)
  215 18.948513891 157.240.23.35 → 10.203.96.113 QUIC 90 Protected Payload (KP0)
  216 18.948513981 157.240.23.35 → 10.203.96.113 QUIC 314 Protected Payload (KP0)
  217 18.948696002 10.203.96.113 → 157.240.23.35 QUIC 76 Protected Payload (KP0), DCID=ba00376723ec623b
  218 18.973183917 104.121.230.99 → 10.203.96.113 QUIC 393 Protected Payload (KP0)
  219 18.973184428 104.121.230.99 → 10.203.96.113 QUIC 135 Protected Payload (KP0)
  220 18.973527760 10.203.96.113 → 104.121.230.99 QUIC 77 Protected Payload (KP0), DCID=027ad48e41412f1a
  221 18.975712626 10.203.96.113 → 157.240.23.35 QUIC 77 Protected Payload (KP0), DCID=ba00376723ec623b
  222 18.976359806 10.203.96.113 → 104.121.230.99 QUIC 83 Protected Payload (KP0), DCID=027ad48e41412f1a
  223 18.976436730 104.121.230.99 → 10.203.96.113 QUIC 64 Protected Payload (KP0)
  224 19.002389846 10.203.96.113 → 104.121.230.99 QUIC 74 Protected Payload (KP0), DCID=027ad48e41412f1a
  225 19.005741234 104.121.230.99 → 10.203.96.113 QUIC 65 Protected Payload (KP0)
  226 19.015691451 3.254.238.163 → 10.203.96.113 TCP 74 443 → 58280 [SYN, ACK] Seq=0 Ack=1 Win=64582 Len=0 MSS=1330 SACK_PERM TSval=1049949590 TSecr=2218996160 WS=128
  227 19.015745252 10.203.96.113 → 3.254.238.163 TCP 66 58280 → 443 [ACK] Seq=1 Ack=1 Win=64512 Len=0 TSval=2218996337 TSecr=1049949590
  228 19.016228195 10.203.96.113 → 3.254.238.163 SSL 1384 
  229 19.016234768 10.203.96.113 → 3.254.238.163 TLSv1.2 552 Client Hello (SNI=unagi.amazon.in)
  230 19.068280249 3.254.238.163 → 10.203.96.113 TCP 66 443 → 58274 [ACK] Seq=7197 Ack=56010 Win=56576 Len=0 TSval=2330149777 TSecr=2218996218
  231 19.075740100 3.254.238.163 → 10.203.96.113 TCP 66 443 → 58274 [ACK] Seq=7197 Ack=58866 Win=56576 Len=0 TSval=2330149780 TSecr=2218996221
  232 19.075740431 3.254.238.163 → 10.203.96.113 TCP 66 443 → 58274 [ACK] Seq=7197 Ack=61722 Win=56576 Len=0 TSval=2330149785 TSecr=2218996224
  233 19.082971223 3.254.238.163 → 10.203.96.113 TCP 66 443 → 58274 [ACK] Seq=7197 Ack=64578 Win=56576 Len=0 TSval=2330149790 TSecr=2218996228
  234 19.082971403 3.254.238.163 → 10.203.96.113 TCP 66 443 → 58274 [ACK] Seq=7197 Ack=67434 Win=56576 Len=0 TSval=2330149791 TSecr=2218996231
  235 19.086235818 3.254.238.163 → 10.203.96.113 TCP 66 443 → 58274 [ACK] Seq=7197 Ack=70290 Win=56576 Len=0 TSval=2330149793 TSecr=2218996234
  236 19.089523046 3.254.238.163 → 10.203.96.113 TCP 66 443 → 58274 [ACK] Seq=7197 Ack=73146 Win=56576 Len=0 TSval=2330149796 TSecr=2218996237
  237 19.095605250 3.254.238.163 → 10.203.96.113 TCP 66 443 → 58274 [ACK] Seq=7197 Ack=76002 Win=56576 Len=0 TSval=2330149803 TSecr=2218996241
  238 19.098840069 3.254.238.163 → 10.203.96.113 TCP 66 443 → 58274 [ACK] Seq=7197 Ack=78858 Win=56576 Len=0 TSval=2330149806 TSecr=2218996241
  239 19.098840300 3.254.238.163 → 10.203.96.113 TCP 66 443 → 58274 [ACK] Seq=7197 Ack=81714 Win=56576 Len=0 TSval=2330149806 TSecr=2218996244
  240 19.098840360 3.254.238.163 → 10.203.96.113 TCP 66 443 → 58274 [ACK] Seq=7197 Ack=85998 Win=56576 Len=0 TSval=2330149807 TSecr=2218996247
  241 19.102408553 3.254.238.163 → 10.203.96.113 TCP 66 443 → 58274 [ACK] Seq=7197 Ack=88854 Win=56576 Len=0 TSval=2330149811 TSecr=2218996250
  242 19.105656277 3.254.238.163 → 10.203.96.113 TCP 66 443 → 58274 [ACK] Seq=7197 Ack=91710 Win=56576 Len=0 TSval=2330149813 TSecr=2218996250
  243 19.105656968 3.254.238.163 → 10.203.96.113 TCP 66 443 → 58274 [ACK] Seq=7197 Ack=94566 Win=56576 Len=0 TSval=2330149813 TSecr=2218996254
  244 19.108884574 3.254.238.163 → 10.203.96.113 TCP 66 443 → 58274 [ACK] Seq=7197 Ack=98850 Win=56576 Len=0 TSval=2330149817 TSecr=2218996257
  245 19.112142316 3.254.238.163 → 10.203.96.113 TCP 66 443 → 58274 [ACK] Seq=7197 Ack=101706 Win=92416 Len=0 TSval=2330149820 TSecr=2218996260
  246 19.115408114 3.254.238.163 → 10.203.96.113 TCP 66 443 → 58274 [ACK] Seq=7197 Ack=103743 Win=113152 Len=0 TSval=2330149824 TSecr=2218996260
  247 19.133223581 104.121.230.99 → 10.203.96.113 QUIC 996 Protected Payload (KP0)
  248 19.133224252 104.121.230.99 → 10.203.96.113 QUIC 449 Protected Payload (KP0)
  249 19.133224343 104.121.230.99 → 10.203.96.113 QUIC 159 Protected Payload (KP0)
  250 19.133224433 104.121.230.99 → 10.203.96.113 QUIC 73 Protected Payload (KP0)
  251 19.133606557 10.203.96.113 → 104.121.230.99 QUIC 77 Protected Payload (KP0), DCID=027ad48e41412f1a
  252 19.133662061 10.203.96.113 → 104.121.230.99 QUIC 73 Protected Payload (KP0), DCID=027ad48e41412f1a
  253 19.136432743 104.121.230.99 → 10.203.96.113 QUIC 159 Protected Payload (KP0)
  254 19.136433083 104.121.230.99 → 10.203.96.113 QUIC 1292 Protected Payload (KP0)
  255 19.136582893 10.203.96.113 → 104.121.230.99 QUIC 73 Protected Payload (KP0), DCID=027ad48e41412f1a
  256 19.139712777 104.121.230.99 → 10.203.96.113 QUIC 1292 Protected Payload (KP0)
  257 19.139713338 104.121.230.99 → 10.203.96.113 QUIC 1292 Protected Payload (KP0)
  258 19.139713438 104.121.230.99 → 10.203.96.113 QUIC 1292 Protected Payload (KP0)
  259 19.139713538 104.121.230.99 → 10.203.96.113 QUIC 939 Protected Payload (KP0)
  260 19.139713638 104.121.230.99 → 10.203.96.113 QUIC 1494 Protected Payload (KP0)
  261 19.140140156 10.203.96.113 → 104.121.230.99 QUIC 73 Protected Payload (KP0), DCID=027ad48e41412f1a
  262 19.140202553 10.203.96.113 → 104.121.230.99 QUIC 73 Protected Payload (KP0), DCID=027ad48e41412f1a
  263 19.142028026 10.203.96.113 → 3.254.238.163 TCP 66 58274 → 443 [FIN, ACK] Seq=103743 Ack=7197 Win=59392 Len=0 TSval=2218996464 TSecr=2330149824
  264 19.142977782 104.121.230.99 → 10.203.96.113 QUIC 159 Protected Payload (KP0)
  265 19.142978173 104.121.230.99 → 10.203.96.113 QUIC 73 Protected Payload (KP0)
  266 19.142978243 104.121.230.99 → 10.203.96.113 QUIC 159 Protected Payload (KP0)
  267 19.142978313 104.121.230.99 → 10.203.96.113 QUIC 1292 Protected Payload (KP0)
  268 19.143294234 10.203.96.113 → 104.121.230.99 QUIC 73 Protected Payload (KP0), DCID=027ad48e41412f1a
  269 19.143396185 10.203.96.113 → 104.121.230.99 QUIC 73 Protected Payload (KP0), DCID=027ad48e41412f1a
  270 19.146224053 3.254.238.163 → 10.203.96.113 TLSv1.3 681 Application Data
  271 19.146277523 10.203.96.113 → 3.254.238.163 TCP 54 58274 → 443 [RST] Seq=103743 Win=0 Len=0
  272 19.156735331 104.121.230.99 → 10.203.96.113 QUIC 1292 Protected Payload (KP0)
  273 19.156735792 104.121.230.99 → 10.203.96.113 QUIC 1292 Protected Payload (KP0)
  274 19.157032086 10.203.96.113 → 104.121.230.99 QUIC 73 Protected Payload (KP0), DCID=027ad48e41412f1a
  275 19.159999646 104.121.230.99 → 10.203.96.113 QUIC 1292 Protected Payload (KP0)
  276 19.160111164 10.203.96.113 → 104.121.230.99 QUIC 73 Protected Payload (KP0), DCID=027ad48e41412f1a
  277 19.166513858 104.121.230.99 → 10.203.96.113 QUIC 1292 Protected Payload (KP0)
  278 19.172278298 104.121.230.99 → 10.203.96.113 QUIC 1292 Protected Payload (KP0)
  279 19.172278759 104.121.230.99 → 10.203.96.113 QUIC 1494 Protected Payload (KP0)
  280 19.172510813 10.203.96.113 → 104.121.230.99 QUIC 73 Protected Payload (KP0), DCID=027ad48e41412f1a
  281 19.175546240 104.121.230.99 → 10.203.96.113 QUIC 1494 Protected Payload (KP0)
  282 19.175546530 104.121.230.99 → 10.203.96.113 QUIC 1494 Protected Payload (KP0)
  283 19.175546600 104.121.230.99 → 10.203.96.113 QUIC 1494 Protected Payload (KP0)
  284 19.175546671 104.121.230.99 → 10.203.96.113 QUIC 1494 Protected Payload (KP0)
  285 19.175546731 104.121.230.99 → 10.203.96.113 QUIC 1494 Protected Payload (KP0)
  286 19.175546801 104.121.230.99 → 10.203.96.113 QUIC 1494 Protected Payload (KP0)
  287 19.175709555 10.203.96.113 → 104.121.230.99 QUIC 73 Protected Payload (KP0), DCID=027ad48e41412f1a
  288 19.175791258 10.203.96.113 → 104.121.230.99 QUIC 73 Protected Payload (KP0), DCID=027ad48e41412f1a
  289 19.175846932 10.203.96.113 → 104.121.230.99 QUIC 73 Protected Payload (KP0), DCID=027ad48e41412f1a
  290 19.182098633 104.121.230.99 → 10.203.96.113 QUIC 1494 Protected Payload (KP0)
  291 19.182099565 104.121.230.99 → 10.203.96.113 QUIC 377 Protected Payload (KP0)
  292 19.186538707 10.203.96.113 → 104.121.230.99 QUIC 73 Protected Payload (KP0), DCID=027ad48e41412f1a
  293 19.193148137 3.254.238.163 → 10.203.96.113 TCP 66 443 → 58280 [ACK] Seq=1 Ack=1319 Win=64000 Len=0 TSval=1049949765 TSecr=2218996338
  294 19.193148738 3.254.238.163 → 10.203.96.113 TCP 66 443 → 58280 [ACK] Seq=1 Ack=1805 Win=63616 Len=0 TSval=1049949765 TSecr=2218996338
  295 19.196453038 104.121.230.99 → 10.203.96.113 QUIC 161 Protected Payload (KP0)
  296 19.196453489 104.121.230.99 → 10.203.96.113 QUIC 1494 Protected Payload (KP0)
  297 19.196453569 104.121.230.99 → 10.203.96.113 QUIC 1494 Protected Payload (KP0)
  298 19.196453639 104.121.230.99 → 10.203.96.113 QUIC 1494 Protected Payload (KP0)
  299 19.196453719 104.121.230.99 → 10.203.96.113 QUIC 1494 Protected Payload (KP0)
  300 19.196453789 104.121.230.99 → 10.203.96.113 QUIC 1494 Protected Payload (KP0)
  301 19.196453869 104.121.230.99 → 10.203.96.113 QUIC 1494 Protected Payload (KP0)
  302 19.196453949 104.121.230.99 → 10.203.96.113 QUIC 1494 Protected Payload (KP0)
  303 19.196543587 3.254.238.163 → 10.203.96.113 TLSv1.3 310 Server Hello, Change Cipher Spec, Application Data, Application Data
  304 19.196588641 10.203.96.113 → 3.254.238.163 TCP 66 58280 → 443 [ACK] Seq=1805 Ack=245 Win=64512 Len=0 TSval=2218996518 TSecr=1049949766
  305 19.196711571 10.203.96.113 → 104.121.230.99 QUIC 73 Protected Payload (KP0), DCID=027ad48e41412f1a
  306 19.196779899 10.203.96.113 → 104.121.230.99 QUIC 73 Protected Payload (KP0), DCID=027ad48e41412f1a
  307 19.196810446 10.203.96.113 → 104.121.230.99 QUIC 73 Protected Payload (KP0), DCID=027ad48e41412f1a
  308 19.196841254 10.203.96.113 → 104.121.230.99 QUIC 73 Protected Payload (KP0), DCID=027ad48e41412f1a
  309 19.197482072 10.203.96.113 → 3.254.238.163 TLSv1.3 130 Change Cipher Spec, Application Data
  310 19.197656539 10.203.96.113 → 3.254.238.163 TLSv1.3 1194 Application Data
  311 19.199689130 104.121.230.99 → 10.203.96.113 QUIC 1494 Protected Payload (KP0)
  312 19.199689441 104.121.230.99 → 10.203.96.113 QUIC 1494 Protected Payload (KP0)
  313 19.199689511 104.121.230.99 → 10.203.96.113 QUIC 1494 Protected Payload (KP0)
  314 19.199762577 10.203.96.113 → 3.254.238.163 TLSv1.3 1384 
  315 19.199773257 10.203.96.113 → 3.254.238.163 TLSv1.3 98 Application Data
  316 19.199827789 10.203.96.113 → 104.121.230.99 QUIC 73 Protected Payload (KP0), DCID=027ad48e41412f1a
  317 19.199870599 10.203.96.113 → 104.121.230.99 QUIC 73 Protected Payload (KP0), DCID=027ad48e41412f1a
  318 19.216193866 10.203.96.113 → 3.254.238.163 TCP 74 60098 → 443 [SYN] Seq=0 Win=64240 Len=0 MSS=1460 SACK_PERM TSval=2218996538 TSecr=0 WS=1024
  319 19.222767719 157.240.23.35 → 10.203.96.113 QUIC 1274 Protected Payload (KP0)
  320 19.222768180 104.121.230.99 → 10.203.96.113 QUIC 1494 Protected Payload (KP0)
  321 19.222768250 104.121.230.99 → 10.203.96.113 QUIC 1494 Protected Payload (KP0)
  322 19.222768310 104.121.230.99 → 10.203.96.113 QUIC 1494 Protected Payload (KP0)
  323 19.222768381 104.121.230.99 → 10.203.96.113 QUIC 1494 Protected Payload (KP0)
  324 19.222768451 104.121.230.99 → 10.203.96.113 QUIC 1494 Protected Payload (KP0)
  325 19.222768521 104.121.230.99 → 10.203.96.113 QUIC 1494 Protected Payload (KP0)
  326 19.223082278 10.203.96.113 → 104.121.230.99 QUIC 78 Protected Payload (KP0), DCID=027ad48e41412f1a
  327 19.223139495 10.203.96.113 → 104.121.230.99 QUIC 73 Protected Payload (KP0), DCID=027ad48e41412f1a
  328 19.223172246 10.203.96.113 → 104.121.230.99 QUIC 73 Protected Payload (KP0), DCID=027ad48e41412f1a
  329 19.226036843 104.121.230.99 → 10.203.96.113 QUIC 1494 Protected Payload (KP0)
  330 19.226037164 104.121.230.99 → 10.203.96.113 QUIC 1494 Protected Payload (KP0)
  331 19.226037234 104.121.230.99 → 10.203.96.113 QUIC 1494 Protected Payload (KP0)
  332 19.226037294 104.121.230.99 → 10.203.96.113 QUIC 1494 Protected Payload (KP0)
  333 19.226037364 157.240.23.35 → 10.203.96.113 QUIC 1050 Protected Payload (KP0)
  334 19.226225476 10.203.96.113 → 104.121.230.99 QUIC 73 Protected Payload (KP0), DCID=027ad48e41412f1a
  335 19.226294164 10.203.96.113 → 104.121.230.99 QUIC 74 Protected Payload (KP0), DCID=027ad48e41412f1a
  336 19.226477467 10.203.96.113 → 157.240.23.35 QUIC 80 Protected Payload (KP0), DCID=ba00376723ec623b
  337 19.235816542 104.121.230.99 → 10.203.96.113 QUIC 1494 Protected Payload (KP0)
  338 19.235816853 104.121.230.99 → 10.203.96.113 QUIC 1494 Protected Payload (KP0)
  339 19.235816923 104.121.230.99 → 10.203.96.113 QUIC 1494 Protected Payload (KP0)
  340 19.235816983 104.121.230.99 → 10.203.96.113 QUIC 1494 Protected Payload (KP0)
  341 19.235817053 104.121.230.99 → 10.203.96.113 QUIC 1494 Protected Payload (KP0)
